<?xml version="1.0" ?>
<?xml-stylesheet version="1.0" href="../../stylesheets/contact2html.xsl" type="text/xsl"?>
<contactDataSet xmlns:common="http://lca.jrc.it/ILCD/Common" xmlns="http://lca.jrc.it/ILCD/Contact" xmlns:xsi="http://www.w3.org/2001/XMLSchema-instance" version="1.1" xsi:schemaLocation="http://lca.jrc.it/ILCD/Contact ../../schemas/ILCD_ContactDataSet.xsd">
	<contactInformation>
		<dataSetInformation>
			<common:UUID>5236c70e-03a1-4c84-aacf-3dd5d4f9b3ab</common:UUID>
			<common:shortName xml:lang="en">Data created by the Office of the Second National Pollution Source Census of the Ministry of Ecology and Environment and organized by Chang Huimin of the Tiangong Project Team Data in ILCD format</common:shortName>
			<common:shortName xml:lang="zh">生态环境部第二次全国污染源普查工作办公室创建数据，天工计划团队常慧敏整理数据为ILCD格式</common:shortName>
			<common:name xml:lang="en">Data created by the Office of the Second National Pollution Source Census of the Ministry of Ecology and Environment and organized by Chang Huimin of the Tiangong Project Team Data in ILCD format</common:name>
			<common:name xml:lang="zh">生态环境部第二次全国污染源普查工作办公室创建数据，天工计划团队常慧敏整理数据为ILCD格式</common:name>
			<classificationInformation>
				<common:classification>
					<common:class level="0">Persons</common:class>
				</common:classification>
			</classificationInformation>
			<email>huiminchang@tsinghua.edu.cn</email>
		</dataSetInformation>
	</contactInformation>
	<administrativeInformation>
		<publicationAndOwnership>
			<common:dataSetVersion>01.00.000</common:dataSetVersion>
		</publicationAndOwnership>
	</administrativeInformation>
</contactDataSet>
