<?xml version="1.0" encoding="utf-8"?>
<?xml-stylesheet version="1.0" href="../../stylesheets/contact2html.xsl" type="text/xsl"?>
<contactDataSet xmlns:common="http://lca.jrc.it/ILCD/Common" xmlns="http://lca.jrc.it/ILCD/Contact" xmlns:xsi="http://www.w3.org/2001/XMLSchema-instance" version="1.1" xsi:schemaLocation="http://lca.jrc.it/ILCD/Contact ../../schemas/ILCD_ContactDataSet.xsd">
	<contactInformation>
		<dataSetInformation>
			<common:UUID>5b7a579f-14f3-4823-9068-a74efb5b1c79</common:UUID>
			<common:shortName xml:lang="en">Jiaqi Lu</common:shortName>
			<common:shortName xml:lang="zh">陆嘉麒</common:shortName>
			<common:name xml:lang="en">Jiaqi Lu</common:name>
			<common:name xml:lang="zh">陆嘉麒</common:name>
			<classificationInformation>
				<common:classification>
					<common:class level="0">Persons</common:class>
				</common:classification>
			</classificationInformation>
			<email>wilsherelu@foxmail.com</email>
		</dataSetInformation>
	</contactInformation>
	<administrativeInformation>
		<publicationAndOwnership>
			<common:dataSetVersion>00.02.001</common:dataSetVersion>
		</publicationAndOwnership>
	</administrativeInformation>
</contactDataSet>
