<?xml version="1.0" encoding="utf-8"?>
<?xml-stylesheet version="1.0" href="../../stylesheets/contact2html.xsl" type="text/xsl"?>
<contactDataSet xmlns:common="http://lca.jrc.it/ILCD/Common" xmlns="http://lca.jrc.it/ILCD/Contact" xmlns:xsi="http://www.w3.org/2001/XMLSchema-instance" version="1.1" xsi:schemaLocation="http://lca.jrc.it/ILCD/Contact ../../schemas/ILCD_ContactDataSet.xsd">
	<contactInformation>
		<dataSetInformation>
			<common:UUID>2778f790-ab21-40d6-994b-4283d9af2f73</common:UUID>
			<common:shortName xml:lang="zh">王一冰</common:shortName>
			<common:name xml:lang="zh">王一冰</common:name>
			<common:shortName xml:lang="en"> Wang Yibing</common:shortName>
			<common:name xml:lang="en"> Wang Yibing</common:name>
			<classificationInformation>
				<common:classification>
					<common:class level="0">Persons</common:class>
				</common:classification>
			</classificationInformation>
			<email>5402121008@email.ncu.edu.cn</email>
		</dataSetInformation>
	</contactInformation>
	<administrativeInformation>
		<publicationAndOwnership>
			<common:dataSetVersion>00.01.005</common:dataSetVersion>
		</publicationAndOwnership>
	</administrativeInformation>
</contactDataSet>
